{
  "schema_version": 1,
  "snapshot_date": "2026-08-21",
  "taken_at_utc": "2026-08-21T06:27:50+00:00",
  "source_api": "https://openrouter.ai/api/v1/models",
  "license_of_data": "openrouter-public-api",
  "row_count": 3,
  "rows": [
    {
      "schema_version": 1,
      "snapshot_date": "2026-08-21",
      "provider": "openrouter",
      "model": "ent-anthropic-claude-haiku-4-5",
      "model_is_proposed_entity": true,
      "openrouter_model_id": "anthropic/claude-haiku-4.5",
      "canonical_slug": "anthropic/claude-4.5-haiku-20251001",
      "display_name": "Anthropic: Claude Haiku 4.5",
      "developer_hint": "anthropic",
      "usd_per_m_input": 1.0,
      "usd_per_m_output": 5.0,
      "usd_per_m_cache_read": 0.1,
      "usd_per_m_cache_write": 1.25,
      "context_tokens": 200000,
      "max_output_tokens": 64000,
      "throughput_tps_median": null,
      "latency_s_p50": null,
      "modality": "text+image+file->text",
      "is_moderated": true,
      "supported_parameters": [
        "include_reasoning",
        "max_completion_tokens",
        "max_tokens",
        "reasoning",
        "response_format",
        "stop",
        "structured_outputs",
        "temperature",
        "tool_choice",
        "tools",
        "top_k",
        "top_p"
      ],
      "openrouter_created_unix": 1760547638,
      "source_api": "https://openrouter.ai/api/v1/models",
      "license_of_data": "openrouter-public-api"
    },
    {
      "schema_version": 1,
      "snapshot_date": "2026-08-21",
      "provider": "openrouter",
      "model": "ent-google-gemma-4-26b-a4b-it-free",
      "model_is_proposed_entity": true,
      "openrouter_model_id": "google/gemma-4-26b-a4b-it:free",
      "canonical_slug": "google/gemma-4-26b-a4b-it-20260403",
      "display_name": "Google: Gemma 4 26B A4B  (free)",
      "developer_hint": "google",
      "usd_per_m_input": 0.0,
      "usd_per_m_output": 0.0,
      "usd_per_m_cache_read": null,
      "usd_per_m_cache_write": null,
      "context_tokens": 262144,
      "max_output_tokens": 32768,
      "throughput_tps_median": null,
      "latency_s_p50": null,
      "modality": "text+image+video->text",
      "is_moderated": false,
      "supported_parameters": [
        "include_reasoning",
        "max_tokens",
        "reasoning",
        "response_format",
        "seed",
        "temperature",
        "tool_choice",
        "tools",
        "top_p"
      ],
      "openrouter_created_unix": 1775227989,
      "source_api": "https://openrouter.ai/api/v1/models",
      "license_of_data": "openrouter-public-api"
    },
    {
      "schema_version": 1,
      "snapshot_date": "2026-08-21",
      "provider": "openrouter",
      "model": "ent-mistralai-ministral-8b",
      "model_is_proposed_entity": true,
      "openrouter_model_id": "mistralai/ministral-8b",
      "canonical_slug": "mistralai/ministral-8b",
      "display_name": "Mistral: Ministral 8B",
      "developer_hint": "mistralai",
      "usd_per_m_input": 0.11,
      "usd_per_m_output": 0.11,
      "usd_per_m_cache_read": null,
      "usd_per_m_cache_write": null,
      "context_tokens": 128000,
      "max_output_tokens": null,
      "throughput_tps_median": null,
      "latency_s_p50": null,
      "modality": "text->text",
      "is_moderated": false,
      "supported_parameters": [
        "frequency_penalty",
        "max_tokens",
        "presence_penalty",
        "response_format",
        "seed",
        "stop",
        "structured_outputs",
        "temperature",
        "top_p"
      ],
      "openrouter_created_unix": 1729123200,
      "source_api": "https://openrouter.ai/api/v1/models",
      "license_of_data": "openrouter-public-api"
    }
  ]
}
